{"$id":"https://surfaces.dev/schemas/surfaceops-designer-review-ui/surfaceops-designer-review-ui-evidence.v0.schema.json","$schema":"https://json-schema.org/draft/2020-12/schema","additionalProperties":false,"properties":{"args":{"additionalProperties":false,"properties":{"decisionLedger":{"const":"artifacts/p4/surfaceops-decision-ledger.json"},"designerEvidence":{"const":"artifacts/designer-workflow-trace/evidence.json"},"designerReport":{"const":"artifacts/designer-workflow-trace/designer-workflow-trace-report.json"},"fixture":{"const":"fixtures/surfaceops-designer-review-ui"},"kanbanLiveEvidence":{"const":"artifacts/surfaceops-kanban-live/evidence.json"},"kanbanLiveOperationPlan":{"const":"artifacts/surfaceops-kanban-live/surfaceops-kanban-live-operation-plan.json"},"out":{"const":"artifacts/surfaceops-designer-review-ui"},"reviewEvidence":{"const":"artifacts/p4/evidence.json"}},"required":["designerEvidence","designerReport","reviewEvidence","decisionLedger","kanbanLiveEvidence","kanbanLiveOperationPlan","fixture","out"],"type":"object"},"artifacts":{"items":{"additionalProperties":false,"properties":{"hash":{"pattern":"^[0-9a-f]{64}$","type":"string"},"hashAlgorithm":{"const":"sha256"},"path":{"minLength":1,"pattern":"^(?!/)(?!.*(?:^|/)\\.)(?!.*//)(?!.*\\\\)[^\\u0000]+$","type":"string"},"schemaId":{"type":"string"},"sourceRef":{"type":["string","null"]}},"required":["path","schemaId","hashAlgorithm","hash","sourceRef"],"type":"object"},"maxItems":5,"minItems":5,"type":"array"},"boundaryRefs":{"items":{"additionalProperties":false,"properties":{"hash":{"pattern":"^[0-9a-f]{64}$","type":"string"},"hashAlgorithm":{"const":"sha256"},"path":{"minLength":1,"pattern":"^(?!/)(?!.*(?:^|/)\\.)(?!.*//)(?!.*\\\\)[^\\u0000]+$","type":"string"},"schemaId":{"type":"string"},"sourceRef":{"type":["string","null"]}},"required":["path","schemaId","hashAlgorithm","hash","sourceRef"],"type":"object"},"maxItems":6,"minItems":6,"type":"array"},"checkedAt":{"const":"1970-01-01T00:00:00.000Z"},"command":{"const":"interfacectl surfaces surfaceops-designer-review-ui proof"},"contractId":{"const":"surfaceops-designer-review-ui-proof"},"diagnostics":{"items":{"additionalProperties":false,"properties":{"artifactPath":{"type":"string"},"canonicalMessage":{"type":"string"},"code":{"type":"string"},"fixtureCoverage":{"type":"string"},"jsonPointer":{"type":"string"},"message":{"type":"string"},"phase":{"type":"string"},"promotionStatus":{"enum":["allowed","blocked","review_required"]},"severity":{"enum":["error","warning","review"]},"sourceRef":{"type":["string","null"]},"stage":{"type":"string"},"suggestedAction":{"type":"string"},"trigger":{"type":"string"},"validationResult":{"enum":["valid","invalid","review_required"]}},"required":["code","trigger","canonicalMessage","message","severity","stage","phase","validationResult","promotionStatus","artifactPath","jsonPointer","sourceRef","fixtureCoverage","suggestedAction"],"type":"object"},"maxItems":12,"minItems":12,"type":"array"},"diagnosticsRegistry":{"items":{"additionalProperties":false,"properties":{"artifactPath":{"type":"string"},"canonicalMessage":{"type":"string"},"code":{"type":"string"},"fixtureCoverage":{"type":"string"},"jsonPointer":{"type":"string"},"message":{"type":"string"},"phase":{"type":"string"},"promotionStatus":{"enum":["allowed","blocked","review_required"]},"severity":{"enum":["error","warning","review"]},"sourceRef":{"type":["string","null"]},"stage":{"type":"string"},"suggestedAction":{"type":"string"},"trigger":{"type":"string"},"validationResult":{"enum":["valid","invalid","review_required"]}},"required":["code","trigger","canonicalMessage","message","severity","stage","phase","validationResult","promotionStatus","artifactPath","jsonPointer","sourceRef","fixtureCoverage","suggestedAction"],"type":"object"},"maxItems":12,"minItems":12,"type":"array"},"environment":{"additionalProperties":false,"properties":{"generatedAt":{"const":"1970-01-01T00:00:00.000Z"},"host":{"type":"null"}},"required":["generatedAt","host"],"type":"object"},"fixtureRefs":{"items":{"additionalProperties":false,"properties":{"hash":{"pattern":"^[0-9a-f]{64}$","type":"string"},"hashAlgorithm":{"const":"sha256"},"path":{"minLength":1,"pattern":"^(?!/)(?!.*(?:^|/)\\.)(?!.*//)(?!.*\\\\)[^\\u0000]+$","type":"string"},"schemaId":{"type":"string"},"sourceRef":{"type":["string","null"]}},"required":["path","schemaId","hashAlgorithm","hash","sourceRef"],"type":"object"},"maxItems":17,"minItems":17,"type":"array"},"governanceOutcome":{"additionalProperties":false,"properties":{"blockingDiagnosticCodes":{"items":false,"maxItems":1,"minItems":1,"prefixItems":[{"const":"SOURCE_REVIEW_EXPIRED"}],"type":"array"},"renewalRequiredBeforeHandoff":{"const":true},"sourceExceptionStatus":{"const":"expired-blocked"},"status":{"const":"blocked"},"targetHandoffAllowed":{"const":false}},"required":["status","targetHandoffAllowed","sourceExceptionStatus","renewalRequiredBeforeHandoff","blockingDiagnosticCodes"],"type":"object"},"promotionStatus":{"const":"blocked"},"provenance":{"additionalProperties":false,"properties":{"generatedAt":{"const":"1970-01-01T00:00:00.000Z"},"generator":{"type":"string"},"sourceRefs":{"items":{"type":"string"},"type":"array"}},"required":["generatedAt","generator","sourceRefs"],"type":"object"},"runId":{"type":"string"},"schemaClosure":{"items":{"additionalProperties":false,"properties":{"hash":{"pattern":"^[0-9a-f]{64}$","type":"string"},"hashAlgorithm":{"const":"sha256"},"path":{"minLength":1,"pattern":"^(?!/)(?!.*(?:^|/)\\.)(?!.*//)(?!.*\\\\)[^\\u0000]+$","type":"string"},"schemaId":{"type":"string"},"sourceRef":{"type":["string","null"]}},"required":["path","schemaId","hashAlgorithm","hash","sourceRef"],"type":"object"},"maxItems":22,"minItems":22,"type":"array"},"schemaId":{"const":"surfaceops-designer-review-ui-evidence.v0"},"status":{"const":"pass"},"targetId":{"const":"surfaceops-designer-review-ui"},"validationResults":{"items":{"additionalProperties":false,"properties":{"actualResult":{"enum":["valid","invalid","review_required"]},"diagnosticCodes":{"items":{"type":"string"},"type":"array"},"expectedDiagnosticCodes":{"items":{"type":"string"},"type":"array"},"expectedResult":{"enum":["valid","invalid","review_required"]},"fixturePath":{"type":"string"},"matched":{"const":true},"promotionStatus":{"enum":["allowed","blocked","review_required"]}},"required":["fixturePath","expectedResult","actualResult","promotionStatus","expectedDiagnosticCodes","diagnosticCodes","matched"],"type":"object"},"maxItems":15,"minItems":15,"type":"array"},"version":{"const":"0.0.0"}},"required":["schemaId","version","runId","contractId","targetId","status","promotionStatus","governanceOutcome","command","args","checkedAt","environment","schemaClosure","fixtureRefs","boundaryRefs","artifacts","validationResults","diagnostics","diagnosticsRegistry","provenance"],"type":"object"}