{"args":{"decisionLedger":"artifacts/p4/surfaceops-decision-ledger.json","designerEvidence":"artifacts/designer-workflow-trace/evidence.json","designerReport":"artifacts/designer-workflow-trace/designer-workflow-trace-report.json","fixture":"fixtures/surfaceops-designer-review-ui","kanbanLiveEvidence":"artifacts/surfaceops-kanban-live/evidence.json","kanbanLiveOperationPlan":"artifacts/surfaceops-kanban-live/surfaceops-kanban-live-operation-plan.json","out":"artifacts/surfaceops-designer-review-ui","reviewEvidence":"artifacts/p4/evidence.json"},"artifacts":[{"hash":"87c9c46a2a6ea969e9712ac9222fbaaf59fd85256cfde66f05db5c0f24e3a71b","hashAlgorithm":"sha256","path":"artifacts/surfaceops-designer-review-ui/surfaceops-designer-review-ui-target-selection.json","schemaId":"surfaceops-designer-review-ui-target-selection.v0","sourceRef":null},{"hash":"a72f8ebf4fa15aee5d11b7422e485a36c080b4f0368415a5d8d8ab73ff55a3fa","hashAlgorithm":"sha256","path":"artifacts/surfaceops-designer-review-ui/surfaceops-designer-review-workbench.json","schemaId":"surfaceops-designer-review-workbench.v0","sourceRef":null},{"hash":"7f11540904a6880b77b1699b099b44d13bc222b609c89e7a2a636fa20d539034","hashAlgorithm":"sha256","path":"artifacts/surfaceops-designer-review-ui/surfaceops-designer-review-decision-receipt.json","schemaId":"surfaceops-designer-review-decision-receipt.v0","sourceRef":null},{"hash":"740740d8170dba2211fe74ebc0d917f01b393a22af43dd467c8eb9b59fb87cb9","hashAlgorithm":"sha256","path":"artifacts/surfaceops-designer-review-ui/surfaceops-designer-review-ui-report.json","schemaId":"surfaceops-designer-review-ui-report.v0","sourceRef":null},{"hash":"3dcfe306db3191f464ab59e0628d02b682e644f6f8d7e75e0ff3ba9b297ade23","hashAlgorithm":"sha256","path":"artifacts/surfaceops-designer-review-ui/evidence.json","schemaId":"surfaceops-designer-review-ui-evidence.v0","sourceRef":null}],"boundaryRefs":[{"hash":"c02c0d48ed5c60fd67fb7921783b89a058642425032f159513fc35629e3a7e52","hashAlgorithm":"sha256","path":"artifacts/designer-workflow-trace/evidence.json","schemaId":"designer-workflow-trace-evidence.v0","sourceRef":null},{"hash":"2ee959e6168825f1873ab7b8281cc77b9a0dfae38171c21f324a72925e9327fd","hashAlgorithm":"sha256","path":"artifacts/designer-workflow-trace/designer-workflow-trace-report.json","schemaId":"designer-workflow-trace-report.v0","sourceRef":null},{"hash":"a9de1573bc5c4dcd9e0d509d8b60885470a4d6cb2bfcbc0eff5ed451997d71f3","hashAlgorithm":"sha256","path":"artifacts/p4/evidence.json","schemaId":"review-judgment-evidence.v0","sourceRef":null},{"hash":"91dd2b08dc7c99f2ff28c6dca2862379269f0f89c7feb63a073bd51fc5f1ebb8","hashAlgorithm":"sha256","path":"artifacts/p4/surfaceops-decision-ledger.json","schemaId":"surfaceops-decision-ledger.v0","sourceRef":null},{"hash":"394d6d84835bc5bfd27eb114838f392b637638ed5d05277e7fce71a92d7a52f3","hashAlgorithm":"sha256","path":"artifacts/surfaceops-kanban-live/evidence.json","schemaId":"surfaceops-kanban-live-evidence.v0","sourceRef":null},{"hash":"e35f01528cde39132204053143730254812a36d9f39adec68e0be2d641da9d7b","hashAlgorithm":"sha256","path":"artifacts/surfaceops-kanban-live/surfaceops-kanban-live-operation-plan.json","schemaId":"surfaceops-kanban-live-operation-plan.v0","sourceRef":null}],"checkedAt":"1970-01-01T00:00:00.000Z","command":"interfacectl surfaces surfaceops-designer-review-ui proof","contractId":"surfaceops-designer-review-ui-proof","diagnostics":[{"artifactPath":"fixtures/surfaceops-designer-review-ui/invalid/authority-override.surfaceops-designer-review-ui.json","canonicalMessage":"Designer review UI must not let kanban.cards override SurfaceOps decisions.","code":"SURFACEOPS_DESIGNER_REVIEW_AUTHORITY_OVERRIDE","fixtureCoverage":"invalid/authority-override.surfaceops-designer-review-ui.json","jsonPointer":"/candidate/authority","message":"Designer review UI must not let kanban.cards override SurfaceOps decisions.","phase":"surfaceops-designer-review-ui","promotionStatus":"blocked","severity":"error","sourceRef":null,"stage":"authority","suggestedAction":"Keep SurfaceOps review authority explicit and regenerate designer review UI evidence.","trigger":"Designer review UI must not let kanban.cards override SurfaceOps decisions.","validationResult":"invalid"},{"artifactPath":"fixtures/surfaceops-designer-review-ui/mutations/hash-mismatch.surfaceops-designer-review-ui-evidence.json","canonicalMessage":"Designer review UI evidence hash does not match the evidence manifest.","code":"SURFACEOPS_DESIGNER_REVIEW_EVIDENCE_HASH_MISMATCH","fixtureCoverage":"mutations/hash-mismatch.surfaceops-designer-review-ui-evidence.json","jsonPointer":"/mutationOperations/0","message":"Designer review UI evidence hash does not match the evidence manifest.","phase":"surfaceops-designer-review-ui","promotionStatus":"blocked","severity":"error","sourceRef":null,"stage":"evidence","suggestedAction":"Keep SurfaceOps review authority explicit and regenerate designer review UI evidence.","trigger":"Designer review UI evidence hash does not match the evidence manifest.","validationResult":"invalid"},{"artifactPath":"fixtures/surfaceops-designer-review-ui/invalid/missing-evidence-ref.surfaceops-designer-review-ui.json","canonicalMessage":"Designer review UI requires exact evidence refs before decisions are enabled.","code":"SURFACEOPS_DESIGNER_REVIEW_EVIDENCE_REF_MISSING","fixtureCoverage":"invalid/missing-evidence-ref.surfaceops-designer-review-ui.json","jsonPointer":"/candidate/evidenceRefs","message":"Designer review UI requires exact evidence refs before decisions are enabled.","phase":"surfaceops-designer-review-ui","promotionStatus":"blocked","severity":"error","sourceRef":null,"stage":"workbench","suggestedAction":"Keep SurfaceOps review authority explicit and regenerate designer review UI evidence.","trigger":"Designer review UI requires exact evidence refs before decisions are enabled.","validationResult":"invalid"},{"artifactPath":"fixtures/surfaceops-designer-review-ui/invalid/handoff-while-blocked.surfaceops-designer-review-ui.json","canonicalMessage":"Designer review UI must not approve handoff while upstream governance is blocked.","code":"SURFACEOPS_DESIGNER_REVIEW_HANDOFF_WHILE_BLOCKED","fixtureCoverage":"invalid/handoff-while-blocked.surfaceops-designer-review-ui.json","jsonPointer":"/candidate/decision/state","message":"Designer review UI must not approve handoff while upstream governance is blocked.","phase":"surfaceops-designer-review-ui","promotionStatus":"blocked","severity":"error","sourceRef":null,"stage":"governance","suggestedAction":"Keep handoff blocked until the governed source review is renewed.","trigger":"Designer review UI must not approve handoff while upstream governance is blocked.","validationResult":"invalid"},{"artifactPath":"fixtures/surfaceops-designer-review-ui/invalid/hidden-decision.surfaceops-designer-review-ui.json","canonicalMessage":"Designer review UI decisions must be visible in the receipt and evidence refs.","code":"SURFACEOPS_DESIGNER_REVIEW_HIDDEN_DECISION","fixtureCoverage":"invalid/hidden-decision.surfaceops-designer-review-ui.json","jsonPointer":"/candidate/decision","message":"Designer review UI decisions must be visible in the receipt and evidence refs.","phase":"surfaceops-designer-review-ui","promotionStatus":"blocked","severity":"error","sourceRef":null,"stage":"decision","suggestedAction":"Keep SurfaceOps review authority explicit and regenerate designer review UI evidence.","trigger":"Designer review UI decisions must be visible in the receipt and evidence refs.","validationResult":"invalid"},{"artifactPath":"fixtures/surfaceops-designer-review-ui/review/live-kanban-required.surfaceops-designer-review-ui.json","canonicalMessage":"Designer review UI needs the local live kanban adapter evidence before browser proof.","code":"SURFACEOPS_DESIGNER_REVIEW_LIVE_KANBAN_REQUIRED","fixtureCoverage":"review/live-kanban-required.surfaceops-designer-review-ui.json","jsonPointer":"/candidate/liveKanbanBoundary","message":"Designer review UI needs the local live kanban adapter evidence before browser proof.","phase":"surfaceops-designer-review-ui","promotionStatus":"review_required","severity":"review","sourceRef":null,"stage":"live-boundary","suggestedAction":"Run the local-live kanban proof and browser proof before claiming the designer review UI loop.","trigger":"Designer review UI needs the local live kanban adapter evidence before browser proof.","validationResult":"review_required"},{"artifactPath":"fixtures/surfaceops-designer-review-ui/invalid/mirror-status-override.surfaceops-designer-review-ui.json","canonicalMessage":"Mirrored kanban status must be derived from the SurfaceOps decision receipt.","code":"SURFACEOPS_DESIGNER_REVIEW_MIRROR_STATUS_INVALID","fixtureCoverage":"invalid/mirror-status-override.surfaceops-designer-review-ui.json","jsonPointer":"/candidate/kanbanMirror/mirroredStatus","message":"Mirrored kanban status must be derived from the SurfaceOps decision receipt.","phase":"surfaceops-designer-review-ui","promotionStatus":"blocked","severity":"error","sourceRef":null,"stage":"mirror","suggestedAction":"Mirror only the structured SurfaceOps decision receipt back to kanban.cards.","trigger":"Mirrored kanban status must be derived from the SurfaceOps decision receipt.","validationResult":"invalid"},{"artifactPath":"fixtures/surfaceops-designer-review-ui/invalid/production-adapter-claim.surfaceops-designer-review-ui.json","canonicalMessage":"Production adapter behavior is outside the designer review UI proof.","code":"SURFACEOPS_DESIGNER_REVIEW_PRODUCTION_ADAPTER_FORBIDDEN","fixtureCoverage":"invalid/production-adapter-claim.surfaceops-designer-review-ui.json","jsonPointer":"/candidate/boundaryClaims","message":"Production adapter behavior is outside the designer review UI proof.","phase":"surfaceops-designer-review-ui","promotionStatus":"blocked","severity":"error","sourceRef":null,"stage":"boundary","suggestedAction":"Keep production auth, hosted pers